{
  "$schema": "https://json-schema.org/draft/2020-12/schema",
  "$id": "https://veripower.local/skills/specification/features.schema.json",
  "title": "features.json — the module's feature list (authored, never derived)",
  "description": "The feature spine: every id is referenced by at least one child <child>.md §5 SourceFeature (enforced by check-coverage), and the simulation-plan agent derives testpoints and tests from these entries. Authored by the specification stage's Wave 1; design.md §1.3 points here and carries no table. Values are free prose — no script parses inside a field. Every field except coverage_intent is required and non-empty: a blank one is a defect, not a default.",
  "type": "array",
  "minItems": 1,
  "items": {
    "type": "object",
    "required": [
      "id",
      "name",
      "description",
      "mode_interface",
      "priority",
      "happy_path",
      "corner_cases",
      "negative_cases"
    ],
    "additionalProperties": false,
    "properties": {
      "id": {
        "description": "The feature identifier child §5 SourceFeature rows and testpoints refer to.",
        "type": "string",
        "minLength": 1
      },
      "name": {
        "description": "Short label. Reaches the TB testlist and the human-read case-results summary.",
        "type": "string",
        "minLength": 1
      },
      "description": {
        "description": "What the feature is, including any RTL formula that pins it.",
        "type": "string",
        "minLength": 1
      },
      "mode_interface": {
        "description": "The interface group or operating mode this feature exercises.",
        "type": "string",
        "minLength": 1
      },
      "priority": {
        "description": "Free text — the vocabulary is the project's, not this schema's.",
        "type": "string",
        "minLength": 1
      },
      "happy_path": {
        "description": "Main-path behaviour to verify.",
        "type": "string",
        "minLength": 1
      },
      "corner_cases": {
        "description": "Boundary behaviour to verify.",
        "type": "string",
        "minLength": 1
      },
      "negative_cases": {
        "description": "Behaviour on invalid or out-of-contract stimulus.",
        "type": "string",
        "minLength": 1
      },
      "coverage_intent": {
        "description": "Optional coverage goal. Absent means absent; nothing substitutes a value.",
        "type": "string",
        "minLength": 1
      }
    }
  }
}
